{
  "id": "graficas_tan_sec",
  "category": "00_fundamentos",
  "topic": "05_trigonometria",
  "topic_id": "FUN-05",
  "script_source": "scripts/grafics/00_fundamentos/05_trigonometria/graficas_tan_sec.py",
  "image_path": "assets/images/grafics/00_fundamentos/05_trigonometria/graficas_tan_sec.svg",
  "description": "Gráficas de tangente, cotangente, secante y cosecante",
  "used_in": [
    "theory/FUN-05-Teoria-Trigonometria.md"
  ],
  "section": "5.11 Gráficas de funciones trigonométricas",
  "format": "SVG (Vectorial)"
}