{
  "id": "angulos_complementarios_suplementarios",
  "category": "00_fundamentos",
  "topic": "04_geometria",
  "topic_id": "FUN-04",
  "script_source": "scripts/grafics/00_fundamentos/04_geometria/angulos_complementarios_suplementarios.py",
  "image_path": "assets/images/grafics/00_fundamentos/04_geometria/angulos_complementarios_suplementarios.svg",
  "description": "Ángulos complementarios (90°) y suplementarios (180°)",
  "used_in": [
    "theory/FUN-04-Teoria-Geometria.md"
  ],
  "section": "4.2",
  "format": "SVG (Vectorial)"
}