{
  "id": "solidos_geometricos",
  "category": "00_fundamentos",
  "topic": "04_geometria",
  "topic_id": "FUN-04",
  "script_source": "scripts/grafics/00_fundamentos/04_geometria/solidos_geometricos.py",
  "image_path": "assets/images/grafics/00_fundamentos/04_geometria/solidos_geometricos.svg",
  "description": "Sólidos: prisma, pirámide, cilindro, cono, esfera",
  "used_in": [
    "theory/FUN-04-Teoria-Geometria.md"
  ],
  "section": "4.10",
  "format": "SVG (Vectorial)"
}